title,type,post_dttm,-1,0,1
Министр экономического развития ПМР Оболоник: газа в регионе хватит на 11 дней,economic,2025-01-20,0.006045428991715836,0.9401188913643688,0.0538356796439155
Монголия утвердила квоты на импорт животноводческой продукции на 2025 год,economic,2025-01-20,0.01012837493229945,0.11237853980790753,0.877493085259793
После чаепития с четой Байденов в Белом доме Трамп отправится на инаугурацию,political,2025-01-20,0.005393924628968624,0.9587554926653165,0.03585058270571495
Володин предложил подготовить межфракционную инициативу о запрете вейпов,political,2025-01-20,0.009679170417917857,0.8994852947856568,0.0908355347964254
"Путин: Россия исходит из того, что диалог с США будет на равноправной основе",political,2025-01-20,0.005294734112652621,0.9325976120103244,0.06210765387702293
Путин: самое главное в урегулировании на Украине это устранить первопричины,political,2025-01-20,0.03257095873913499,0.9260554369937755,0.04137360426708966
"Путин: власти продолжат бороться за интересы российского народа, это смысл СВО",political,2025-01-20,0.006031666508071187,0.9339105078392902,0.06005782565263844
Путин: Россия никогда не отказывалась от диалога с любой администрацией США,political,2025-01-20,0.0071382706971921265,0.9422591418098409,0.050602587492966915
Путин на заседании с членами Совбеза попросил Лаврова доложить о ситуации в США,political,2025-01-20,0.007457670328170936,0.9213402129340353,0.07120211673779352
Путин предложил членам Совбеза обсудить ситуацию в чувствительных регионах РФ,political,2025-01-20,0.006788799958372127,0.9374453624736607,0.055765837567967144
Путин проводит совещание с членами Совбеза РФ,political,2025-01-20,0.012561275715204425,0.1812816440961515,0.806157080188644
Лавров и глава МИД Армении обсудят двусторонние отношения на встрече 21 января,political,2025-01-20,0.004928928786179164,0.9738274760690495,0.021243595144771327
"Глава МИД Армении отправился с визитом в Москву, где встретится с Лавровым",political,2025-01-20,0.004819663764093209,0.9711213112493747,0.02405902498653218
Политолог Дугин: соглашение с Ираном усилит позиции России в диалоге с США,political,2025-01-20,0.006858684724346524,0.0983620166409969,0.8947792986346566
ABC News: Трамп собрал рекордные 250 млн долларов на инаугурационные мероприятия,political,2025-01-20,0.0167439748542589,0.7103537385952229,0.2729022865505183
Хинштейн возмутился отпуском в Индии курской чиновницы Ирины Мусьял,political,2025-01-20,0.010146733287473415,0.09555554591719778,0.8942977207953288
Володин поручил разработать поправку о праве субъектов определять модель МСУ,political,2025-01-20,0.008595729647118196,0.06479204812603656,0.9266122222268453
"WSJ: речь Трампа на инаугурации будет оптимистичнее, чем перед первым сроком",political,2025-01-20,0.004235972505303195,0.9667482825726446,0.02901574492205218
GT: телефонный разговор Си Цзиньпина и Трампа задал тон отношениям Китая и США,political,2025-01-20,0.0042708875342605795,0.9544141359684265,0.04131497649731283
Навроцкий: упрощенное вступление Украины в ЕС угрожает экономике Польши,political,2025-01-20,0.03581610517247543,0.9151860366784202,0.04899785814910437
«Революция здравого смысла». О чем Трамп говорил в инаугурационной речи,political,2025-01-20,0.009915374715860074,0.2008953262705082,0.7891892990136318
Фицо рассказал Эрдогану о своей встрече с Путиным,political,2025-01-20,0.006849350243936062,0.9372395714683035,0.05591107828776036
"Трамп в инаугурационной речи не упомянул ни Россию, ни Украину",political,2025-01-20,0.038021591917951805,0.8657310506719065,0.09624735741014172
Президенты и миллиардеры на инаугурации Трампа. Фото,political,2025-01-20,0.004552972001312657,0.9618146335001273,0.033632394498559925
Кадры присяги вице-президента США Джей Ди Вэнса,political,2025-01-20,0.007402239916648225,0.9509723495262553,0.04162541055709638
Трамп объявил ЧП в сфере энергетики США,political,2025-01-20,0.016348814140319436,0.6109971037778732,0.3726540820818074
Трамп пообещал вернуть Панамский канал: мы его отдавали не Китаю,political,2025-01-20,0.012943727252969044,0.7880027019058137,0.19905357084121728
Трамп объявил о переименовании Мексиканского залива в Американский,political,2025-01-20,0.011428459557245705,0.09348087320792631,0.895090667234828
США выйдут из Парижского соглашения по климату,political,2025-01-20,0.010229351016345164,0.8945288839222388,0.09524176506141588
Трамп объявил о подготовке миссии США на Марс,political,2025-01-20,0.011172825036287179,0.1471381945309557,0.8416889804327572
Кадры присяги Трампа на пост президента США,political,2025-01-20,0.0035428920760040656,0.9712332267764302,0.02522388114756558
Трамп заявил на инаугурации — «Я миротворец»,political,2025-01-20,0.006603383371621876,0.9461440774472434,0.04725253918113474
"Трамп объявил, что США признают только два гендера",political,2025-01-20,0.011910315400060009,0.16383330333444118,0.8242563812654987
Трамп пообещал объявить наркокартели террористическими организациями,political,2025-01-20,0.013441916129317317,0.14306487942321167,0.8434932044474709
Трамп пообещал «исторические указы» для «революции здравого смысла»,political,2025-01-20,0.009494429370144816,0.8558450777776909,0.1346604928521644
На инаугурацию Трампа пришли три бывших президента,political,2025-01-20,0.005351742480860785,0.964779377623372,0.02986887989576705
Видео с первыми минутами Трампа на должности президента США,political,2025-01-20,0.0033117876799923823,0.9736572993418748,0.023030912978132666
Шварценеггер опроверг слухи об отъезде из США в связи с победой Трампа,political,2025-01-20,0.004352037470819991,0.9675834072701948,0.028064555258985387
Трамп объявил о начале «золотого века Америки»,political,2025-01-20,0.008835868377670688,0.05788591886516557,0.9332782127571637
Промышленный эксперт Хазанов: Трамп будет жестким в отношении экономики России,economic,2025-01-20,0.009964115344077255,0.6352305992601943,0.3548052853957284
"Политолог Давыдова: США, скорее всего, сохранят санкции на энергоресурсы России",economic,2025-01-20,0.013166434130790739,0.16546541324375647,0.8213681526254527
Байден покинул Вашингтон после инаугурации Трампа,political,2025-01-20,0.005899469189083368,0.9529742972060611,0.041126233604855636
На воронежской нефтебазе в Лисках снова возник пожар из-за дрона,political,2025-01-20,0.7527698667790915,0.1354917330717264,0.1117384001491822
Речь Трампа на инаугурации полностью на русском языке. Видео,political,2025-01-20,0.005601627798987286,0.9479012559712023,0.046497116229810474
Новая администрация США закрыла приложение для мигрантов,political,2025-01-20,0.00708147959978941,0.9377240407447108,0.0551944796554998
Зеленский оценил приход к власти Трампа словами о готовности к миру,political,2025-01-20,0.006255917114690529,0.9656279109715672,0.02811617191374219
Bloomberg узнал о возможном закрытии азиатских НПЗ из-за санкций США,economic,2025-01-23,0.010494014320233188,0.1275512791616854,0.8619547065180814
Венгрия предложила Словакии вариант с поставками газа,economic,2025-01-23,0.007815897215674427,0.9661305862934181,0.026053516490907536
Что происходило в торговле России и Китая в 2024 году,economic,2025-01-23,0.007817509402524311,0.1296092924972581,0.8625731981002175
Ефимов анонсировал начало работ на 8 проектах редевелопмента в 2025 году,economic,2025-01-23,0.009738464650757036,0.20184773310548587,0.788413802243757
"ЦБ объяснил, почему инфляция за год разогналась выше прогноза",economic,2025-01-23,0.007378897590833745,0.06727647619592503,0.9253446262132413
Путин назвал успешным 2024 год для российской экономики,economic,2025-01-22,0.015494299543678033,0.14839010933801486,0.8361155911183071
Товарно-сырьевая биржа создаст Национальное биржевое ценовое агентство,economic,2025-01-22,0.009055794549655929,0.07878912139903767,0.9121550840513065
Ефимов рассказал о планах реорганизации части бывшей промзоны «Курьяново»,economic,2025-01-22,0.008124165975955513,0.953343986469856,0.03853184755418847
Путин поручил урегулировать «переезд» компаний из недружественных стран,economic,2025-01-22,0.00838793060437265,0.08973120821413273,0.9018808611814946
Росстат назвал самые подорожавшие продукты за 2024 год,economic,2025-01-22,0.016598778044742947,0.16721838349010118,0.8161828384651559
"В ООН сообщили, что долг США перед организацией составляет $2,8 млрд",economic,2025-01-22,0.010158675692433597,0.947688808942566,0.04215251536500028
«СберИндекс» оценил средние потребительские расходы россиян,economic,2025-01-22,0.013941710291011511,0.08798845867162793,0.8980698310373605
Миллиардер предупредил о грозящей Британии «долговой спирали смерти»,economic,2025-01-21,0.030552278051750807,0.6004969531605615,0.3689507687876877
КС предписал изменить подход к налогам при выходе участника из компании,economic,2025-01-21,0.010563014185233179,0.9066532355092003,0.08278375030556637
Ефимов сообщил о выделении более 20 га в ЗАО на масштабные инвестпроекты,economic,2025-01-21,0.01976028660257048,0.866024758400287,0.11421495499714236
Ефимов сообщил о принятии Москвой 50 решений о редевелопменте в 2024 году,economic,2025-01-21,0.00837757857358516,0.940789300248892,0.05083312117752302
Власти понизили план по инвестициям на фоне высокой ставки,economic,2025-01-21,0.0069884933475790325,0.9367398884294497,0.056271618222971394
Трамп поставил слово «пошлины» в один ряд с любовью и богом,economic,2025-01-21,0.005904933454209752,0.9548461913908137,0.039248875154976416
"Что такое ИСЖ, чем отличается от НСЖ, плюсы и минусы",economic,2025-01-23,0.01524300385616766,0.8511081597839084,0.13364883635992403
ЦБ отметил снижение средней ставки по вкладам в 10 крупнейших банках,economic,2025-01-23,0.007475478420736395,0.06414681504800776,0.9283777065312558
Брокер «Сбера» составил портрет российского инвестора-подростка,economic,2025-01-23,0.008518129344707914,0.08288563899759024,0.9085962316577019
Акции «Софтлайна» упали на 6% после новостей о претензиях кредитора,economic,2025-01-23,0.7025306305952385,0.13873348583756212,0.1587358835671996
«ВТБ Мои Инвестиции» добавили акции «ИКС 5» в топ-10 российских акций,economic,2025-01-23,0.018624522362801134,0.10587906163006094,0.8754964160071379
ЦБ Турции снизил ключевую ставку до 45% годовых,economic,2025-01-23,0.010527938937746438,0.9050706944178911,0.08440136664436258
"Индекс Мосбиржи, акции «Сургутнефтегаза» и ВК: дайджест инвестора",economic,2025-01-23,0.01175517325388116,0.13146181557521847,0.8567830111709004
Индекс S&P 500 обновил исторический рекорд,economic,2025-01-22,0.01962783856201251,0.3024600650361095,0.677912096401878
Почему падает доллар: 7 причин текущего укрепления рубля и прогноз на год,economic,2025-01-22,0.006663554397726029,0.046721406955708276,0.9466150386465656
Официальный курс доллара США упал ниже ₽99 впервые за два месяца,economic,2025-01-22,0.012342665695160137,0.8958683087381109,0.09178902556672912
Что такое страховая пенсия: размер в 2025 году и формула расчета,economic,2025-01-22,0.011385266982169672,0.8448371442525766,0.14377758876525373
Что такое прибыль: что и как влияет на финансовый результат,economic,2025-01-22,0.015292348349171167,0.8506329030879712,0.13407474856285764
Мосбиржа сузит ценовые границы для акций и ОФЗ на утренних торгах,economic,2025-01-22,0.009823115508867473,0.06666536197007009,0.9235115225210625
Товарно-сырьевая биржа запланировала запуск фьючерсов на бензин в феврале,economic,2025-01-22,0.00929504296076631,0.08420736308790028,0.9064975939513334
Товарно-сырьевая биржа заменит непроизносимое СПбМТСБ простыми словами,economic,2025-01-22,0.009628394962540093,0.8867238796591282,0.10364772537833172
Игорь Шувалов: сегодня для предпринимателей открылись новые рыночные ниши,economic,2025-01-23,0.009631379877256463,0.9169863383174435,0.07338228180530018
Путин поручил пересмотреть нормативную базу по морским перевозкам нефти,economic,2025-01-23,0.008130536401216679,0.0965397924703988,0.8953296711283846
Путин попросил экспертов спрогнозировать шаги для технологического прорыва,economic,2025-01-23,0.008893215282145591,0.08647041412711043,0.9046363705907439
Путин призвал предпринимателей к конкретным делам для технологического развития,economic,2025-01-23,0.006606868370019214,0.9340155306113375,0.05937760101864345
Путин призвал настроить механизм техсотрудничества для извлечения выгоды,economic,2025-01-23,0.007763411101743304,0.9383188291742188,0.05391775972403783
Глава ФАС Шаскольский: цены на картофель выросли из-за низкой базы прошлого года,economic,2025-01-23,0.00799600505540753,0.9057079289883719,0.08629606595622055
Путин заявил о важности роста молодежного технологического предпринимательства,economic,2025-01-23,0.009863664485494182,0.1428007287094327,0.8473356068050732
Путин призвал создать инструменты для роста качества жизни в малых городах,economic,2025-01-23,0.00685978061672568,0.9334663158595612,0.05967390352371322
На льготные кредиты аграрному бизнесу в 2025 году направят более 42 млрд рублей,economic,2025-01-23,0.011513345295348004,0.1083293597519302,0.8801572949527218
Песков отметил участие АСИ во многих социально-экономических процессах,economic,2025-01-23,0.011770987756801583,0.16648543082015396,0.8217435814230445
Путин отошел с заседания АСИ из-за международного телефонного разговора,political,2025-01-23,0.010725147456127262,0.16624909818183073,0.8230257543620421
Путин сообщил о планах созвониться с губернатором Новгородской области Никитиным,political,2025-01-23,0.006921195449156548,0.9743808111998116,0.018697993351032012
В ГД направили проект о заморозке средств и имущества причастных к диверсиям,political,2025-01-23,0.011056243331255359,0.894149830890844,0.09479392577790059
"Захарова: Россия откроет посольства в Нигере, Сьерра-Леоне и Южном Судане",political,2025-01-23,0.008093339873317507,0.08410601962633905,0.9078006405003434
Путин: новая стратегия развития АСИ должна учитывать перемены в России и в мире,political,2025-01-23,0.004457877467821265,0.057766186384332306,0.9377759361478464
СБУ заочно предъявила обвинения трем российским генералам и двум полковникам,political,2025-01-23,0.021515326893354586,0.4297052446899112,0.5487794284167342
Ковальчук: России надо быть сверхсильной для защиты своих интересов в Арктике,political,2025-01-23,0.008990689398425216,0.09928445367107598,0.8917248569304987
Немкин: история Несоевой говорит об отсутствии фактчекинга у либеральных СМИ,political,2025-01-23,0.02399966500597764,0.4388669405639465,0.5371333944300759
Песков: Путин и Пашинян во время разговора не обсуждали работу Армении в ОДКБ,political,2025-01-23,0.004514254241210003,0.9619853867177446,0.033500359041045404
Песков: переговоры Путина и Эрдогана могут быть согласованы за считанные часы,political,2025-01-23,0.008579053537049797,0.9583201340578007,0.03310081240514947
Песков: Россия продолжает контакты с Сирией по актуальным вопросам,political,2025-01-23,0.005737076231740651,0.9376139608289588,0.05664896293930066
Песков: Кремль может рассмотреть блогера Фридмана в качестве интервьюера Путина,political,2025-01-23,0.005282966837598118,0.9640095347000569,0.030707498462345016
Песков: Путин посчитал целесообразным поздравить Трампа с инаугурацией,political,2025-01-23,0.002587640409104526,0.9831410204512865,0.014271339139609046
Песков: Путин в четверг проведет международный телефонный разговор,political,2025-01-23,0.0072267287969361655,0.9089108912414339,0.08386237996163007
"Якушев: для депутатов, которые пройдут в Госдуму в 2026 году, введут новый KPI",political,2025-01-23,0.011308354860184203,0.06768785566433527,0.9210037894754806
Якушев: Участники СВО войдут в списки Единой России на выборах в Госдуму,political,2025-01-23,0.01497832998425394,0.6054542286790626,0.3795674413366835
"ЦИК Белоруссии: явка за два дня досрочного голосования составила 17,67%",political,2025-01-22,0.007911872832229978,0.9328976049298969,0.05919052223787313
Путин 23 января проведет заседание набсовета АСИ по продвижению новых проектов,political,2025-01-22,0.007081590351095859,0.09341543417451457,0.8995029754743895
Путин 23 января проведет совещание с правительством по надзорной деятельности,political,2025-01-22,0.015167017652007057,0.3134551553286435,0.6713778270193496
Почему Латинская Америка оказалась в фокусе внешней политики Трампа,political,2025-01-23,0.014972391737031564,0.7409031945059283,0.24412441375704
Трамп решил попросить Саудовскую Аравию и ОПЕК снизить цены на нефть,political,2025-01-23,0.007413794064964358,0.9076714136456336,0.08491479228940212
Медведев посетил атакованный ракетами и дронами брянский химзавод,political,2025-01-23,0.028804297182523187,0.7443212096242231,0.22687449319325387
Трамп словами «в процессе» описал усилия по урегулированию на Украине,political,2025-01-23,0.023307448698725447,0.951804940852902,0.02488761044837251
Вице-спикер Думы предложил ввести самозапрет на покупки на маркетплейсах,political,2025-01-23,0.060583146257970504,0.6808171620816943,0.25859969166033525
Правительство Эстонии одобрило законопроект о разрыве связей с РПЦ,political,2025-01-23,0.03216562165183474,0.434866534798462,0.5329678435497033
В Кремле не сочли завершением «отмены» номинацию Борисова на «Оскар»,political,2025-01-23,0.01208738287990984,0.9214523188408094,0.06646029827928074
В Венгрии заявили о невыполнении Украиной требований для вступления в ЕС,political,2025-01-23,0.0370573656645798,0.9219708785997527,0.0409717557356674
Проблемами жителей курского приграничья займется координационный совет,political,2025-01-23,0.0091806866915513,0.9290445062857889,0.06177480702265971
Партия Порошенко заявила о риске «крючка уголовных дел» для военных,political,2025-01-23,0.005861612328366274,0.9634862896128368,0.030652098058796845
Раввин рассказал о судьбе уехавших в Израиль в начале спецоперации евреях,political,2025-01-23,0.009795892061700718,0.08693262134848823,0.903271486589811
Суд на Украине отменил арест обвиняемого в дезертирстве Сергея Гнездилова,political,2025-01-23,0.03750061222113223,0.9038202973536494,0.0586790904252183
Минобороны сообщило об отражении контратаки ВСУ в Курской области,political,2025-01-23,0.009343375759739375,0.9698243574881672,0.020832266752093327
Путин поручил провести ревизию танкерного флота России,political,2025-01-23,0.005958093472189481,0.07578940668257562,0.9182524998452348
"Стало известно, ради какого разговора Путин отошел с заседания",political,2025-01-23,0.010819299575530232,0.8556645289710945,0.13351617145337547
В Морской коллегии назвали преимущество «москитного флота» при гиперзвуке,political,2025-01-23,0.015124232139893876,0.08952528792589313,0.8953504799342129
Захарова анонсировала открытие российских посольств в трех странах,political,2025-01-23,0.013313781270154252,0.7468385605470164,0.23984765818282944
ANSA узнало о планах Трампа вывести из Европы 20 тыс. военных США,political,2025-01-23,0.0019080099953562967,0.98877856911545,0.009313420889193654
