title,type,post_dttm,-1,0,1
"Цены в России за 2024 год выросли на 9,52%",economic,2025-01-15,0.012538652831490225,0.25038408238251936,0.7370772647859904
Лукашенко призвал не тратить инвестиции на «барахло»,economic,2025-01-15,0.01081968227365753,0.8932918120188708,0.09588850570747173
РСПП предложил приоритет выкупа экс-владельцам изъятых активов,economic,2025-01-15,0.018847234409337547,0.7034415248215762,0.2777112407690862
Путин поручил рассмотреть вопрос о сроках давности при деприватизации,economic,2025-01-15,0.009407648198250827,0.8792815001521476,0.11131085164960165
Юристы оценили выгодность ставок НДС для бизнеса на «упрощенке»,economic,2025-01-15,0.00978782111069997,0.09607312672249475,0.8941390521668053
"Мишустин заявил, что Россия смогла адаптироваться к санкциям",economic,2025-01-15,0.012538705994542926,0.11480314597406568,0.8726581480313913
Reuters узнал об остановке более 60 нефтяных танкеров после санкций США,economic,2025-01-14,0.02037926238992426,0.5479303790845172,0.4316903585255584
Bloomberg узнал о срочной скупке нефти Китаем из-за санкций против России,economic,2025-01-14,0.016041637038362512,0.8987532203273971,0.08520514263424042
Власти ужесточат наказание за слив закрытых данных банков и таможни,economic,2025-01-13,0.02025997874639942,0.6505952691649276,0.32914475208867305
Куда и сколько качает газа попавшая под атаку БПЛА ВСУ станция «Русская»,economic,2025-01-13,0.008822289656101134,0.9422873733466061,0.04889033699729279
ЦБ исключил заморозку вкладов для борьбы с инфляцией,economic,2025-01-13,0.013215998629703032,0.14196853655577288,0.8448154648145242
Товарооборот между Китаем и Россией обновил рекорд,economic,2025-01-13,0.015507438154284618,0.3689174106991474,0.6155751511465679
США увеличили импорт комплектующих для самолетов из России,economic,2025-01-13,0.0063258231818605825,0.9304002883145063,0.0632738885036331
Аналитики назвали лидирующий сектор по росту средних зарплат,economic,2025-01-13,0.012753667915505916,0.07486274992112502,0.9123835821633691
Британский химический гигант предупредил о гибели промышленности страны,economic,2025-01-13,0.022971135958549337,0.6012479785795116,0.375780885461939
Власти Китая начали платить по долгам квартирами,economic,2025-01-13,0.009194239541041727,0.9241010429448305,0.06670471751412761
Росстат оценил разрыв в зарплатах мужчин и женщин в России,economic,2025-01-12,0.01431309449645501,0.28585531780161616,0.6998315877019289
США увеличили импорт шоколада и какао-продуктов из России в три раза,economic,2025-01-12,0.006198187347391117,0.9298704245568082,0.06393138809580051
"WSJ узнала об экспорте Ираном нефти, переданной КНР на хранение в 2018-м",economic,2025-01-12,0.009687201150762987,0.11087775596856356,0.8794350428806735
Азербайджан приостановил поставки газа в Сербию,economic,2025-01-11,0.011137160942734797,0.9190374736111063,0.06982536544615894
ЦБ опустил официальный курс доллара ниже ₽103,economic,2025-01-15,0.015617768946929768,0.3480138283126997,0.6363684027403705
Минфин занял менее ₽10 млрд на первом в 2025 году аукционе гособлигаций,economic,2025-01-15,0.011935383596375497,0.8569301245179123,0.13113449188571216
Нацбанк Казахстана связал слабость тенге с антироссийскими санкциями,economic,2025-01-15,0.014480169949103281,0.08975785605300042,0.8957619739978963
Совкомбанк снизил максимальные ставки по ряду вкладов,economic,2025-01-15,0.010875134751944253,0.8617574442832285,0.1273674209648271
Количество частных инвесторов на Мосбирже превысило 35 млн человек,economic,2025-01-15,0.007605566838670493,0.06398454355717405,0.9284098896041555
"Как оплатить по QR-коду, начисляется ли кешбэк и как вернуть такую оплату",economic,2025-01-15,0.02488777002429374,0.6059183372207014,0.3691938927550048
Госдума одобрила введение периода охлаждения по кредитам для физлиц,economic,2025-01-15,0.023913412118062798,0.5481248835235534,0.4279617043583839
«Финам» назвал акции с наибольшим потенциалом роста на 2025 год,economic,2025-01-15,0.007447849883559784,0.024796227356174153,0.967755922760266
Глава Ростова-на-Дону подал в отставку,political,2025-01-28,0.007254909815101215,0.9427330239201751,0.050012066264723536
Акции ВК выросли на новости о регистрации Банком России акций Skillbox,economic,2025-01-15,0.014093946708890201,0.03161472164646296,0.954291331644647
Курс доллара в 2025 году: было ли разминкой ослабление рубля в 2024-м,economic,2025-01-15,0.011926714278372842,0.17679322437631106,0.8112800613453162
"Индекс Мосбиржи, акции «Русала», российская валюта: дайджест инвестора",economic,2025-01-15,0.007217469051012283,0.06684913122574815,0.9259333997232395
Ставки заимствования по юаням стали отрицательными из-за профицита валюты,economic,2025-01-15,0.021311250065834914,0.6247978029077395,0.3538909470264257
Средняя ставка по вкладам в топ-10 банков снизилась впервые за два месяца,economic,2025-01-14,0.008957943730506502,0.07412472227198844,0.916917333997505
«Велес Капитал» назвал акции с наибольшим потенциалом роста на I квартал,economic,2025-01-14,0.012566210083864158,0.04783826737096298,0.9395955225451729
Инвесторы пожаловались на сложности с доступом в приложения брокеров,economic,2025-01-14,0.010729260405921337,0.8888995888025858,0.10037115079149303
"Сербия на фоне санкций США не будет национализировать ""Нефтяную индустрию""",economic,2025-01-15,0.014192626961563109,0.14923342906840864,0.8365739439700283
Посол Белоруссии Рогожник: товарооборот России и Белоруссии за год вырос на 105%,economic,2025-01-15,0.006770577090220105,0.8905216398874376,0.10270778302234224
"Росстат: инфляция в России в 2024 году составила 9,52%",economic,2025-01-15,0.010218673191533675,0.2090697778740517,0.7807115489344146
"Росстат: в России с начала года подорожала водка, сосиски и макароны подешевели",economic,2025-01-15,0.010184729738983623,0.191105111288895,0.7987101589721213
Минфин США частично разрешил операции с девятью российскими банками,economic,2025-01-15,0.008136616003883466,0.13122976922609786,0.8606336147700185
"Минфин США: под санкции попали 16 физлиц, АО ""Военторг"" и еще десятки компаний",economic,2025-01-15,0.009827476841532424,0.9237054914655314,0.06646703169293625
Глава НБМ Драгу: Молдавия в 2025 году может столкнуться с двузначной инфляцией,economic,2025-01-15,0.006453967768696015,0.9303387668302924,0.06320726540101165
"""АвтоВАЗ"" рассматривает запуск отдельного бренда для коммерческих автомобилей",economic,2025-01-15,0.02337865910693718,0.47455763904650755,0.5020637018465552
Никишина: продукция российского АПК пользуется большим спросом во Вьетнаме,economic,2025-01-15,0.007400119516429787,0.05283006072838834,0.9397698197551818
"""Союзцемент"": биржа не поможет сдержать рост цен на стройматериалы",economic,2025-01-15,0.011957216909107879,0.15153890397200956,0.8365038791188826
Председатель правительства Запорожской области Ирина Гехт покинула пост,political,2025-01-15,0.023614719795535175,0.6376219874369182,0.3387632927675467
"Глава МИД Ирана: Москва и Тегеран будут сотрудничать в космосе, ИИ и медицине",political,2025-01-15,0.0061639995619323824,0.9543350811749474,0.039500919263120264
"Верховный суд ликвидировал партию ""Гражданская Сила"" по иску Минюста",political,2025-01-15,0.016847987340002563,0.7920867688184887,0.19106524384150875
Аракчи назвал укрепление сотрудничества с Россией важным аспектом договора,political,2025-01-15,0.009911814245518388,0.06470843024190653,0.925379755512575
Балицкий: врио главы Энергодара после ухода Сеновоза станет Максим Пухов,political,2025-01-15,0.011779394282317559,0.895256396064412,0.09296420965327046
Песков назвал переговоры с Туадерой первыми международными переговорами Путина,political,2025-01-15,0.01991372609298157,0.9552751051222901,0.024811168784728523
"Песков: РФ и ЦАР развивают отношения во всех сферах, включая безопасность",political,2025-01-15,0.009726154387744131,0.9376173295113139,0.05265651610094191
Глава Энергодара Сеновоз покинул свой пост ради новых задач,political,2025-01-15,0.011262361018853216,0.8479664587535966,0.14077118022755017
"Лихачев сравнил санкции США против руководства ""Росатома"" с наградным листом",political,2025-01-15,0.012966470538918877,0.937232224357249,0.049801305103832266
РФ и Вьетнам выступили против вмешательства во внутренние дела суверенных стран,political,2025-01-15,0.01165384928243199,0.9267103465374616,0.061635804180106335
РФ и Вьетнам договорились продолжить совершенствовать двусторонние отношения,political,2025-01-15,0.012129551712956474,0.12500037525145943,0.8628700730355842
Президент Вьетнама Кыонг поздравил Россию с успехами в президентство Путина,political,2025-01-15,0.006785386633526729,0.1103987792259476,0.8828158341405257
Мишустин: Россия и Вьетнам имеют большой потенциал для развития отношений,political,2025-01-15,0.005408751029014966,0.05518267729352698,0.939408571677458
Лавров и вице-спикер парламента Словакии Данко обсудили конфликт на Украине,political,2025-01-14,0.8503329889468738,0.10401397723734299,0.04565303381578317
Матвиенко: прекращение сотрудничества России и ЕС произошло не по вине Москвы,political,2025-01-14,0.014506972395905099,0.1819958109904352,0.8034972166136597
Глава администрации Ростова-на-Дону Логвиненко опроверг информацию об отставке,political,2025-01-14,0.004258097252532147,0.9752164129511265,0.0205254897963413
"Володин заявил, что некоторые министерства подходят к работе недобросовестно",political,2025-01-14,0.010054869684935519,0.9037396725174418,0.08620545779762272
В Госдуме началось первое пленарное заседание весенней сессии,political,2025-01-14,0.009316105941338446,0.9153699050147424,0.07531398904391906
"Володин сообщил, что обсудил с Путиным планы работы Госдумы в весеннюю сессию",political,2025-01-14,0.005259653633056876,0.9712000901123516,0.023540256254591583
Песков: переговоры Путина и президента Ирана Пезешкиана пройдут в Кремле,political,2025-01-14,0.006369118272168746,0.9685606829409681,0.025070198786863
Рубио заявил о неизбежности уступок в переговорах с Киевом о НАТО,political,2025-01-15,0.029271835752358703,0.9369542525930683,0.033773911654572955
Премьер Катара объявил о прекращении огня в секторе Газа с 19 января,political,2025-01-15,0.015341155730914118,0.8799803232506377,0.10467852101844817
"Трамп заявил, что добьется мира на Ближнем Востоке через силу",political,2025-01-15,0.005420589708866666,0.9559541047067126,0.03862530558442086
ЦАХАЛ объявила о подготовке к приему освобожденных из Газы заложников,political,2025-01-15,0.025009458319191658,0.32953130879591463,0.6454592328848937
SCMP узнал об отказе дочери Трампа и ее мужа переехать в Белый дом,political,2025-01-15,0.007121522546125923,0.9475719460270616,0.0453065314268126
NYT оценила эффект от закрытия «экономической артерии» на Украине,political,2025-01-15,0.042019458406944946,0.08526140570592414,0.872719135887131
Гладков сообщил о повреждениях при обстреле села Тишанка,political,2025-01-15,0.7073746069815539,0.19072719132184057,0.10189820169660559
Губернатор рассказал об эффективности дрона с оптоволоконной связью,political,2025-01-15,0.02589347904564291,0.7445966690310817,0.22950985192327544
"Кандидат в госсекретари США заявил, что «у Киева кончаются украинцы»",political,2025-01-15,0.012159374638892618,0.9476261124775744,0.04021451288353294
В Будапеште рассказали о планах Орбана на день инаугурации Трампа,political,2025-01-15,0.002419911198976529,0.9843983139494232,0.013181774851600379
Зеленский подписал закон о базовой военной службе вместо срочной,political,2025-01-15,0.012403231923121037,0.9400982043146633,0.04749856376221559
Балицкий сообщил об увольнении главы правительства Запорожской области,political,2025-01-15,0.008133720811532408,0.9663122099357511,0.02555406925271654
Трамп анонсировал сделку Израиля и ХАМАС,political,2025-01-15,0.0110855465781012,0.8664975483122237,0.12241690510967508
Израиль заявил о прогрессе в переговорах с ХАМАС,political,2025-01-15,0.016749338816619528,0.9151329127599486,0.06811774842343199
Туск назвал наилучшие гарантии безопасности для Украины после конфликта,political,2025-01-15,0.8303727772467715,0.10145331122016014,0.06817391153306838
Киев отказался от альтернативы членству в НАТО,political,2025-01-15,0.6754367913960883,0.1922014505224933,0.1323617580814185
Эксперты Давосского форума назвали главные риски 2025 года,political,2025-01-15,0.014315332624473692,0.8438409930887223,0.141843674286804
"Фицо предложил наказание для школьника, не пожавшего руку президенту",political,2025-01-15,0.006998512799827204,0.9465509695962278,0.0464505176039452
"Киселев заявил, что не понял, какие его слова задели «армянских братьев»",political,2025-01-15,0.008411357831406592,0.9400556661367832,0.05153297603181008
Импорт Китаем сырой нефти из России стал рекордным в 2024 году,economic,2025-01-20,0.009491723002057171,0.3220794676101554,0.6684288093877875
Власти запланировали создать рынок платной статистики,economic,2025-01-20,0.02086792442815018,0.646818224639645,0.3323138509322047
"Politico узнала, что Трамп подталкивает ЕС к выбору между США и Китаем",economic,2025-01-20,0.0036710474486446464,0.9652850546506037,0.0310438979007518
Китай в 2024 году нарастил закупки нефти и СПГ из России,economic,2025-01-20,0.00655148767270289,0.1234272897059695,0.8700212226213275
В России вступил в силу приказ о скидке 50% на авиабилеты для детей,economic,2025-01-20,0.008338164572604511,0.9123869499496707,0.07927488547772495
В Европе увидели угрозу экономике в возвращении украинских беженцев домой,economic,2025-01-20,0.010569395777108095,0.9304281563846465,0.05900244783824552
Депутат Бессараб напомнила о важности индексации пенсий,economic,2025-01-19,0.022546035263717006,0.6206102146303549,0.35684375010592806
Костин заявил о необходимости «убить» SWIFT,economic,2025-01-19,0.0196407801747421,0.7590381426907328,0.22132107713452512
"Россия втрое уменьшила экспорт овощей, фруктов и орехов в ЕС",economic,2025-01-19,0.008665892179651843,0.08195865394795922,0.9093754538723889
Ефимов рассказал об определении инвесторов для 14 проектов на конкурсах,economic,2025-01-18,0.015325699126125232,0.7398032362374127,0.2448710646364621
"Трамп vs Байден: при ком было лучше доллару, акциям и экономике США",economic,2025-01-18,0.011658533457477126,0.8739118483238437,0.11442961821867925
Минфин США объявил о чрезвычайных мерах против дефолта через три дня,economic,2025-01-18,0.015009797574927602,0.9311474238702317,0.05384277855484074
Россия и Иран согласовали маршрут газопровода через Азербайджан,economic,2025-01-17,0.009325987929100612,0.10883211716948984,0.8818418949014096
Путин призвал к «конкретным делам» в торговле с Ираном,economic,2025-01-17,0.010928423201781123,0.8580932787186488,0.13097829807957015
Глава Приднестровья обратился к Санду из-за газа: «сдержите слово»,economic,2025-01-17,0.00690035046492944,0.951537049204152,0.041562600330918645
Россельхознадзор запретил ввоз продукции животноводства из ЕС из-за ящура,economic,2025-01-17,0.012526368923190869,0.10266567831259144,0.8848079527642178
ЕС импортировал «беспрецедентный объем» российского СПГ,economic,2025-01-17,0.011283499730981991,0.10037344712179438,0.8883430531472235
Акцию по бесплатному проезду электромобилей продлили на 2025 год,economic,2025-01-17,0.013182364251238365,0.10300395496538668,0.883813680783375
Население Китая сократилось третий год подряд,economic,2025-01-17,0.00858940317726584,0.08871089072865242,0.9026997060940818
Сокращение поставок нефти и газа Норвегией связали с «рассветом России»,economic,2025-01-17,0.014803213973638471,0.7508780778716136,0.23431870815474787
ЦБ опустил официальный курс доллара США ниже ₽102,economic,2025-01-20,0.009476444282745421,0.8026967871740058,0.18782676854324878
«Т-Инвестиции» расширили список торгуемых заблокированных бумаг,economic,2025-01-20,0.022111358735862507,0.44462131798883153,0.5332673232753059
"Инаугурация Трампа, индекс Мосбиржи, акции застройщиков: дайджест",economic,2025-01-20,0.007839604418989728,0.8818190954921669,0.11034130008884349
Инвесторы пожаловались властям на налоговые последствия по X5 и «Русагро»,economic,2025-01-20,0.00862582292492172,0.9324168121841895,0.058957364890888854
Самые богатые люди мира: топ-10 миллиардеров на начало 2025 года,economic,2025-01-19,0.005368252951455087,0.054930045187170096,0.9397017018613749
Девальвация: что это и грозит ли она рублю в 2025 году,economic,2025-01-19,0.01659291243509,0.3506131056300112,0.6327939819348989
Дивидендный календарь — 2025: даты выплат по акциям российских компаний,economic,2025-01-19,0.018707335637121084,0.1679852682120708,0.813307396150808
Топ-10 самых высоких ставок по накопительным счетам до 23% годовых,economic,2025-01-18,0.009087570286231585,0.9066562918908535,0.08425613782291475
«Сжатая пружина выстрелит»: как инвестору отыграть инаугурацию Трампа,economic,2025-01-18,0.005574903065706086,0.9486965267264418,0.045728570207852086
Акции застройщиков выросли за день на 15%: почему и что будет дальше,economic,2025-01-17,0.02990499896436336,0.527229422363177,0.44286557867245957
ЦБ повысил официальный курс доллара США и снизил курс евро,economic,2025-01-17,0.00515145369009547,0.9321674318992492,0.06268111441065533
"ЦБ Норвегии начал поиск кандидатов в главы фонда с активами на $1,8 трлн",economic,2025-01-17,0.006343533817493312,0.9597920306931178,0.03386443548938871
Московский кредитный банк снизил ставки по ряду вкладов,economic,2025-01-17,0.010126867339898572,0.13619474354568556,0.8536783891144157
Брокер Райффайзенбанка повысит комиссию за покупку бумаг на бирже до 3%,economic,2025-01-17,0.01906133053797598,0.3046344244293619,0.6763042450326621
Bank of America назвал 7 возможных сюрпризов для инвесторов в 2025 году,economic,2025-01-17,0.012065203933240507,0.08946678868817513,0.8984680073785845
"Нефтегазовые доходы в 2024 году возросли на 26,2 процента, иные выросли на 26,2",economic,2025-01-20,0.014225867051361371,0.15725119500638232,0.8285229379422564
"Нефть дешевеет на 1-1,5% перед инаугурацией Трампа",economic,2025-01-20,0.006026326720597671,0.9445032910384275,0.04947038224097482
Золото подешевело перед началом церемонии инаугурации Трампа,economic,2025-01-20,0.010796419340893206,0.20032295166299913,0.7888806289961077
Эрдоган рассчитывает на переговоры с Путиным по газу для Словакии на этой неделе,economic,2025-01-20,0.011207436228868765,0.960020885521555,0.028771678249576278
Азербайджан возобновил приостановленные 7 января поставки газа в Болгарию,economic,2025-01-20,0.007997720667163928,0.9531551275624659,0.038847151770370125
FT: победа Трампа изменила повестку Всемирного экономического форума в Давосе,economic,2025-01-20,0.005868573674775594,0.9501611575246437,0.043970268800580775
Депутат Полуянова: курс доллара не изменится в связи с инаугурацией Трампа,economic,2025-01-20,0.005333745847123949,0.9468476694705185,0.04781858468235767
Reuters: возвращение Трампа может привести к разморозке западных активов в РФ,economic,2025-01-20,0.008512254763480298,0.9181310412943832,0.07335670394213648
